{
  "$schema": "https://json-schema.org/draft/2020-12/schema",
  "title": "KnowledgeCard",
  "description": "AI 库中 KnowledgeCards 表的逻辑知识卡（docs/architecture.md §5.2）。时间字段为带时区偏移的 ISO 8601；写入 Base 前由 server/src/base_mapping.ts 按 +08:00 换算。",
  "type": "object",
  "additionalProperties": false,
  "required": [
    "card_id",
    "scope",
    "project_id",
    "category",
    "title",
    "content",
    "tags",
    "entities",
    "target_models",
    "priority",
    "source_doc_token",
    "source_node_token",
    "source_path",
    "source_title",
    "source_revision",
    "source_block_id",
    "updated_at"
  ],
  "properties": {
    "card_id": {
      "type": "string"
    },
    "scope": {
      "type": "string",
      "enum": ["general", "project"]
    },
    "project_id": {
      "type": ["string", "null"]
    },
    "category": {
      "type": "string",
      "enum": [
        "shot_breakdown",
        "storyboard",
        "prompt_technique",
        "camera_lexicon",
        "character_bible",
        "scene_description",
        "visual_style",
        "project_rule",
        "seedance_rule",
        "example"
      ]
    },
    "title": {
      "type": "string"
    },
    "content": {
      "type": "string"
    },
    "tags": {
      "type": "array",
      "items": { "type": "string" }
    },
    "entities": {
      "type": "array",
      "items": { "type": "string" }
    },
    "target_models": {
      "type": "array",
      "items": {
        "type": "string",
        "enum": ["seedance-2.0", "seedance-2.5"]
      }
    },
    "priority": {
      "type": "number"
    },
    "source_doc_token": {
      "type": "string"
    },
    "source_node_token": {
      "type": "string"
    },
    "source_path": {
      "type": "string"
    },
    "source_title": {
      "type": "string"
    },
    "source_revision": {
      "type": "integer"
    },
    "source_block_id": {
      "type": ["string", "null"]
    },
    "updated_at": {
      "type": "string",
      "pattern": "^\\d{4}-\\d{2}-\\d{2}T\\d{2}:\\d{2}:\\d{2}(?:\\.\\d+)?(?:Z|[+-]\\d{2}:\\d{2})$"
    }
  }
}
